{
  "scenario_id": "regulated-doc-quality-recovery",
  "schema_version": "v1",
  "description": "Regulated document-quality workflow recovery case: a malformed tool result is handled and the workflow resumes via checkpoint",
  "tenant_fixture": {
    "group_id": "allura-regulated-docs",
    "cleanup": true
  },
  "principal_fixture": {
    "principal_id": "doc-curator",
    "roles": ["curator"],
    "tenant_ids": ["allura-regulated-docs"],
    "auth_method": "service_identity"
  },
  "process_definition": {
    "id": "regulated-doc-quality",
    "revision": "1"
  },
  "initial_state": {
    "memories": [
      { "content": "Synthetic document: quality standard v1", "score": 0.5 }
    ],
    "proposals": [
      { "content": "Document quality assessment: PASS", "score": 0.92, "tier": "mainstream", "status": "pending" }
    ]
  },
  "tool_fixtures": [
    {
      "tool_name": "memory_search",
      "match": "ordered",
      "response": { "result": { "results": [{ "id": "doc-1", "content": "Synthetic document", "score": 0.5 }] } }
    },
    {
      "tool_name": "governance_proposal_approve",
      "match": "ordered",
      "error": { "code": "TRANSIENT_RETRY", "message": "Approval service temporarily unavailable" }
    },
    {
      "tool_name": "governance_proposal_approve",
      "match": "ordered",
      "response": { "result": { "outcome": "approved", "memory_id": "canonical-doc-recovered" } }
    }
  ],
  "virtual_clock": {
    "start_time": "2026-01-01T00:00:00.000Z",
    "tick_interval_ms": 500
  },
  "random_seed": 42,
  "policy_expectations": [],
  "assertions": {
    "output": { "expected_status": "completed" },
    "state": { "proposal_status": "approved" },
    "audit": { "expected_events": ["proposal_approved"] }
  },
  "approval_breakpoints": [
    { "at_step": 2, "decision": "approve", "rationale": "Recovered from malformed result; human final authority confirmed" }
  ]
}
