{
  "scenario_id": "regulated-doc-quality-cross-tenant",
  "schema_version": "v1",
  "description": "Regulated document-quality workflow security failure case: cross-tenant access to another tenant's documents is denied",
  "tenant_fixture": {
    "group_id": "allura-regulated-docs",
    "cleanup": true
  },
  "principal_fixture": {
    "principal_id": "doc-viewer",
    "roles": ["viewer"],
    "tenant_ids": ["allura-regulated-docs"],
    "auth_method": "mcp_token"
  },
  "process_definition": {
    "id": "regulated-doc-quality",
    "revision": "1"
  },
  "initial_state": {
    "memories": [
      { "content": "Tenant A regulated document", "score": 0.9 }
    ],
    "proposals": []
  },
  "tool_fixtures": [
    {
      "tool_name": "memory_search",
      "match": "ordered",
      "response": { "result": { "results": [] } }
    },
    {
      "tool_name": "memory_add",
      "match": "ordered",
      "error": { "code": "POLICY_DENIED", "message": "TENANT_MISMATCH: Principal 'doc-viewer' is not authorized for tenant 'allura-other-tenant'" }
    }
  ],
  "virtual_clock": {
    "start_time": "2026-01-01T00:00:00.000Z",
    "tick_interval_ms": 1000
  },
  "random_seed": 42,
  "policy_expectations": [
    { "policy_id": "pol-001", "expected_decision": "deny", "at_step": 1 }
  ],
  "assertions": {
    "output": { "expected_status": "failed", "expected_error": "TENANT_MISMATCH" },
    "state": { "memory_count": 0 },
    "audit": { "expected_events": [] }
  }
}
